Risk ID,Risk Title,Description,Portfolio Name,Category,Probability,Impact,Status,Owner,Mitigation Plan,Identified Date,Review Date
RISK-001,Tax Filing Deadline Miss,Risk of missing April 15 tax filing deadline due to incomplete documentation,Finance Operations Portfolio,Compliance,Low,Very High,Open,Tax Specialist,Implement weekly milestone tracking and 2-week buffer before deadline,2026-01-10,2026-02-15
RISK-002,Incomplete Financial Records,Missing vendor invoices and expense receipts could delay tax preparation,Finance Operations Portfolio,Operational,Medium,High,Open,Accountant,Send reminder emails to all departments; implement digital receipt scanning,2026-01-15,2026-02-01
RISK-003,Bank Reconciliation Errors,Discrepancies in bank reconciliation could delay month-end close,Finance Operations Portfolio,Financial,Medium,Medium,Mitigated,Controller,Automated reconciliation tool implemented; daily balance checks,2025-12-20,2026-01-05
RISK-004,GL Posting Delays,Late journal entries from departments could impact close schedule,Finance Operations Portfolio,Operational,High,Medium,Open,Finance Team,Enforce hard deadline 2 days before close; escalation process,2025-12-22,2025-12-30
RISK-005,Regulatory Compliance Changes,New tax regulations effective Jan 2026 may require filing adjustments,Compliance & Risk Management,Compliance,Medium,High,Open,CFO,Legal review scheduled; CPA firm consultation booked,2026-01-05,2026-01-20
RISK-006,Audit Findings Impact,Previous audit findings may require remediation before year-end,Compliance & Risk Management,Compliance,Low,Medium,Mitigated,Senior Accountant,Remediation plan approved; implementation 80% complete,2025-11-15,2026-01-10
RISK-007,BI Dashboard Data Quality,Inconsistent data sources could affect analytics accuracy,Business Intelligence & Analytics,Technical,Medium,Medium,Open,Data Analyst,Data validation rules implemented; weekly quality checks,2026-01-08,2026-02-01
RISK-008,Resource Availability,Key personnel unavailability during critical periods,Finance Operations Portfolio,Operational,Low,High,Accepted,CFO,Cross-training program; backup resources identified,2026-01-12,
