Level,Code,Objective/Description,Indicators,Means of Verification,Assumptions,Progress,Status,Linked KPIs,Linked Tasks
Goal,,Ensure 100% compliant and timely month-end closing and tax filing for TBWA SMP Finance.,"On-time Submission Rate: 92% (Target: 100%), BIR Compliance Rate: 100% (Target: 100%)","Approved BIR receipts, External audit reports, Internal compliance tracker","Finance systems remain stable, Government portals operational, Regulatory requirements unchanged",92%,On Track,"KPI-001, KPI-007",All
Outcome,,Streamlined coordination between Finance Payroll Tax and Treasury teams.,"Average Process Delay: 0.3 days (Target: <1 day), Team Collaboration Score: 87% (Target: 90%)","Task tracker completion logs, Notion workflow logs, Team survey results","All teams follow established deadlines, Communication channels remain effective, Resources adequately allocated",87%,On Track,KPI-009,All
Immediate Objective 1,IM1,Accurate and timely closing of books and reconciliations including journal entries accruals WIP and TB sign-off.,"TB Reconciliation Rate: 98% (Target: 100%), Number of Closing Adjustments: 8 (Target: <10), Days to Close: 7.3 WD (Target: 7 WD)","Reconciliation sheets, GL transaction logs, TB sign-off documents, Audit trail reports","Source data complete and accurate, All entries reviewed by deadline, System uptime maintained, No major unexpected transactions",83%,On Track,"KPI-006, KPI-009, KPI-003","CT-0001, CT-0002, CT-0007, CT-0008, CT-0024, CT-0025, CT-0036"
Immediate Objective 2,IM2,Complete on-time tax filing for payroll VAT and withholding taxes.,"BIR Filing Timeliness: 100% (Target: 100%), Tax Calculation Accuracy: 99.5% (Target: 100%)","BIR confirmation receipts, eFPS filing screenshots, Tax filing tracker","Government portals operational, Tax rates and regulations stable, Supporting documentation complete",100%,Complete,KPI-007,"CT-0003, CT-0004"
Output (IM1),,1. Journal entries and accruals finalized | 2. WIP schedule reconciled | 3. TB reviewed and approved,"Journal Entries Posted: 95% (Target: 100%), Accruals Accuracy: 94% (Target: 95%)","Completed task count per calendar, Monthly compliance sheet, WBS Master task log","Timely reviews and approvals, Supporting documents available",85%,On Track,KPI-008,"CT-0001, CT-0002, CT-0007, CT-0008, CT-0024, CT-0036"
Output (IM2),,1. All BIR forms filed | 2. Tax payments processed | 3. Receipts archived,"Forms Filed vs Required: 100% (Target: 100%)","Filing rate vs deadline tracker, BIR portal confirmations, Tax compliance sheet","Portals accessible during filing window, Payment systems operational",100%,Complete,,"CT-0003, CT-0004"
Activity (IM1),,- Reconcile ledgers (Phase I) | - Post accruals (Phase II) | - Prepare WIP and TB (Phase III) | - Finalize balances (Phase IV) | - Approve entries (TB Sign-off),"Daily Completion Rate: 85% (Target: 100%)","Month-close calendar, Full Task Schedule, WBS Master progress tracking","No data loss or corruption, Team availability maintained, No system downtime",83%,On Track,KPI-003,"CT-0001, CT-0002, CT-0007, CT-0008, CT-0024, CT-0025, CT-0036"
Activity (IM2),,- Compute VAT (CT-0003 CT-0004) | - Prepare 1601C 0619E forms | - Route for approvals | - File returns via eFPS | - Upload proof of filing,"Filing Rate vs Deadline: 100% (Target: 100%)","Tax filing tracker, Task completion logs, eFPS transaction history","eFPS portals accessible, Tax calculations verified, Approvers available",100%,Complete,,"CT-0003, CT-0004"
